排名,品名,評價,評論數,價格
#1,Mouse sem Fio 2.4 Ghz 1200 DPI Preto USB Multilaser - MO251,"4,4 de 5 estrelas",837,"R$20,34"
#2,Mouse Logitech M170 Wireless Preto - 910-004940,"4,8 de 5 estrelas",339,"R$44,36"
#3,"Mouse Gamer, Fortrek, PRO M7 RGB, Preto","4,6 de 5 estrelas",582,"R$49,34"
#4,Mouse Dell WM126,"4,7 de 5 estrelas",326,"R$59,99"
#5,Mouse Optical Basic Com Fio Usb Preto Microsoft - P5800061,"4,9 de 5 estrelas",50,"R$29,90"
#6,Mouse Multilaser Sem Fio 2.4Ghz Preto Usb - MO212,"4,5 de 5 estrelas",46,"R$23,75"
#7,"HP 200 Mouse sem Fio, Preto","4,6 de 5 estrelas",84,"R$47,50"
#8,Mouse Logitech M90 USB Preto - 910-004053,"4,8 de 5 estrelas",110,"R$26,02"
#9,Mouse Sem Fio Mobile Usb Preto Microsoft - U7Z00008,"4,7 de 5 estrelas",197,"R$64,99"
#10,Mouse Logitech M280 Wireless Preto - 910-004284,"4,9 de 5 estrelas",104,"R$70,00"
#11,"Mouse sem Fio MX Master 2S com Tecnologia FLOW para Controle Multi-Computador e Compartilhamento de Arquivos, Conexão por Nanoreceptor USB Unifying ou Bluetooth com Easy-Switch, Logitech","4,7 de 5 estrelas",88,"R$365,01"
#12,"Mouse sem fio Dell, WM326, Preto","4,8 de 5 estrelas",28,"R$89,99"
#13,Mouse Logitech M280 Wireless Vermelho - 910-004286,"4,9 de 5 estrelas",27,"R$64,90"
#14,Mouse Gamer Logitech G502 Hero Preto - 910-005550,"4,9 de 5 estrelas",28,"R$272,62"
#15,Mouse Multilaser Emborrachado Preto Com Fio Usb - MO222,"4,7 de 5 estrelas",52,"R$25,90"
#16,Mouse Sem Fio 2.4 Ghz Usb Box Multilaser Preto - MO264,"4,0 de 5 estrelas",11,"R$24,90"
#17,Mouse Sem Fio Mobile Usb Vermelho Microsoft - U7Z00038,"4,7 de 5 estrelas",197,"R$69,99"
#18,Mouse Gamer Logitech G PRO HERO Preto - 910-005536,"4,6 de 5 estrelas",3,"R$235,18"
#19,Mini Mouse Multilaser Preto - MO205,"3,1 de 5 estrelas",2,"R$14,99"
#20,Mouse Logitech Anywhere MX 2S Wireless Preto - 910-005132,"4,8 de 5 estrelas",105,"R$249,10"
#21,Mouse Multilaser Sem Fio 2.4Ghz Preto E Rosa Usb - MO214,"4,5 de 5 estrelas",46,"R$30,96"
#22,Mouse Sem Fio Mobile Usb Rosa Claro Microsoft - U7Z00028U7Z00028,"4,9 de 5 estrelas",61,"R$75,91"
#23,Mouse Sculpt Comfort Sem Fio Bluetooth Preto Microsoft - H3S00009,"4,6 de 5 estrelas",13,"R$199,00"
#24,Mouse Logitech M720 Triathlon - 910-004790,"4,8 de 5 estrelas",43,"R$199,99"
#25,Mouse Multilaser Sem Fio 2.4Ghz Preto E Branco Usb - MO216,"4,5 de 5 estrelas",46,"R$24,89"
#26,"Mouse Colors 1000 Dpi, Maxprint, Mouses","4,0 de 5 estrelas",2,"R$13,69"
#27,"Mouse Gamer Legacy 6400Dpi Dazz, Outros acessórios para notebooks",,,"R$85,88"
#28,Mouse Multilaser Classic Com Fio Preto Usb - MO007,"4,5 de 5 estrelas",8,"R$15,11"
#29,Mouse Logitech M170 Wireless Vermelho - 910-004941,"4,6 de 5 estrelas",18,"R$39,99"
#30,Mouse Multilaser Classic Preto Ps2 - MO031,,,"R$14,99"
#31,Mouse Philips Monitor Usb 2.0 Spk9413/00 Rgb,"3,7 de 5 estrelas",7,"R$68,50"
#32,Mouse Logitech M535 Bluetooth Preto - 910-004432,"4,8 de 5 estrelas",16,"R$125,00"
#33,Mouse Logitech M170 Wireless Prata - 910-005334,"4,6 de 5 estrelas",30,"R$ 37,83"
#34,Mouse Sem Fio Bluetooth Preto Multilaser - MO254,"4,1 de 5 estrelas",7,"R$74,99"
#35,"Mouse Craft, Maxprint, Mouses","4,3 de 5 estrelas",8,"R$9,42"
#36,"Mouse USB 1000, HP, Mouses, Preto",,,"R$42,05"
#37,Mouse Logitech M105 USB Preto - 910-002958,"4,5 de 5 estrelas",2,"R$39,90"
#38,Mini Mouse Logitech M187 Wireless Coral - 910-005362,"5,0 de 5 estrelas",3,"R$59,90"
#39,Mouse Logitech M110 USB Cinza - 910-005494,"5,0 de 5 estrelas",11,"R$34,90"
#40,Mouse Logitech M185 Wireless Azul - 910-003636,"5,0 de 5 estrelas",14,"R$49,66"
#41,Mouse Ergonomic Sem Fio Usb Preto Microsoft - L6V00009,"4,6 de 5 estrelas",5,"R$244,76"
#42,"Mouse sem Fio X200 Oman, Hp, Mouses",,,"R$39,90"
#43,"Kit Jogo de Chaves 9 Peças Chaves Fenda e Phillips em Aço, Vinik, Prata/Preto","4,1 de 5 estrelas",3,"R$54,95"
#44,"Mouse Mecanico Cyborg 4000 Dpi Dazz, Outros acessórios para notebooks",,,"R$164,93"
#45,Mouse Logitech MX Master 3 Wireless Preto - 910-005647,"4,8 de 5 estrelas",19,
#46,Mouse Gamer Logitech G305 LIGHTSPEED wireless - 910-005281,"4,9 de 5 estrelas",148,"R$246,99"
#47,Mouse Logitech MX Vertical - 910-005447,"4,7 de 5 estrelas",50,"R$368,00"
#48,"Mouse Gamer Pro, Fortrek, Mouses","4,8 de 5 estrelas",8,"R$102,00"
#49,Mouse Sem Fio 2.4 Ghz Usb Box Bulk Multilaser Preto - MO265,"4,0 de 5 estrelas",18,"R$24,99"
#50,Mouse Logitech M510 Wireless Preto - 910-001822,"4,9 de 5 estrelas",23,"R$ 209,00"
#51,"Mouse sem Fio Z3700 Az, Hp, Mouses","4,8 de 5 estrelas",17,"R$61,00"
#52,Mouse Logitech M110 USB Vermelho - 910-005492,"5,0 de 5 estrelas",11,"R$31,69"
#53,Mouse Loch Ness Sem Fio Usb Preto Microsoft - GMF00380,"4,7 de 5 estrelas",22,"R$159,90"
#54,Mouse Gamer Logitech G600 MMO - 910-003879,"4,8 de 5 estrelas",8,"R$399,90"
#55,Mouse Gamer ZOWIE DIVINA S2 Blue Sensor 3360 eSports,"4,0 de 5 estrelas",14,"R$ 459,79"
#56,"Mouse Boreal, OEX, MS319, Mouses, Branco","5,0 de 5 estrelas",1,"R$119,49"
#57,Mouse Sem Fio Mobile Usb Rosa Microsoft - U7Z00062,"4,9 de 5 estrelas",17,"R$78,90"
#58,Mouse Logitech M170 Wireless Azul - 910-004800,"4,6 de 5 estrelas",20,"R$39,99"
#59,Mouse Recarregavel Sem fio com Clique Silencioso,"5,0 de 5 estrelas",4,"R$55,19"
#60,"Mouse Techzone Preto/Azul, Maxprint, Mouses","5,0 de 5 estrelas",2,"R$14,90"
#61,Magic Mouse 2 Apple para Mac Bluetooth MLA02BE/A,"5,0 de 5 estrelas",1,"R$549,00"
#62,Mouse Logitech M280 Wireless  Cinza - 910-004285,"4,9 de 5 estrelas",18,"R$62,95"
#63,"Mouse Wireless Blueeye, Genius, 48596-22-0",,,"R$72,90"
#64,"Mouse Gamer ZOWIE EC-2 Óptico Pequeno com 3200DPI, Sensor 3360, USB, ideal para destros e jogos de FPS E-sports, ZOWIE, Mouses, Preto.","4,4 de 5 estrelas",922,"R$457,64"
#65,"Mouse Ótico Soft 1200 Dpi, Maxprint, Mouses",,,"R$24,90"
#66,Mouse Sem Fio Multilaser 2.4 Ghz Comfort 6 Botões Preto Usb - MO237,"4,3 de 5 estrelas",9,"R$37,90"
#67,Mouse Logitech M110 USB Azul - 910-005491,"4,8 de 5 estrelas",8,"R$31,69"
#68,"Mouse sem Fio X200 Oman Do, Hp, Mouses","4,7 de 5 estrelas",4,"R$53,18"
#69,Mouse Logitech M105 USB Branco - 910-003138,,,"R$37,47"
#70,Mouse sem fio Logitech M187 Preto,,,"R$46,00"
#71,"Mouse sem Fio Z3700, Hp, Mouses","4,3 de 5 estrelas",11,"R$82,50"
#72,Mouse Gamer Logitech G403 Hero - 910-005631,"5,0 de 5 estrelas",2,"R$229,90"
#73,"Mouse Gamer Centrophorus M601-3, Redragon, Mouses","4,4 de 5 estrelas",8,"R$67,85"
#74,Mouse Multilaser Emborrachado Rosa Usb - MO223,"4,7 de 5 estrelas",52,"R$26,50"
#75,Mouse Gamer Logitech G502 LIGHTSPEED - 910-005566,"4,5 de 5 estrelas",2,"R$579,90"
#76,"Mouse Sem Fio Microsoft Mobile 3600, Bluetooth, Preto - PN700008","4,4 de 5 estrelas",46,"R$ 211,16"
#77,Mouse Sem Fio Mobile Usb Azul Escuro Microsoft - U7Z00018,"4,7 de 5 estrelas",197,"R$80,36"
#78,Mini Mouse Logitech M187 Wireless Rosa - 910-005364,"4,8 de 5 estrelas",8,"R$59,90"
#79,"Mouse Usb X900, Hp, Mouses","4,6 de 5 estrelas",20,"R$25,90"
#80,"Mouse Sem Fio Microsoft ARC, Touch Bluetrack - RVF00052","3,0 de 5 estrelas",8,"R$392,99"
#81,"Mouse Gamer Nothosaur M606, Redragon, Mouses, Preto","4,6 de 5 estrelas",3,"R$64,33"
#82,Mouse Logitech M100 USB Preto - 910-001601,"5,0 de 5 estrelas",5,"R$30,60"
#83,Mini Mouse Logitech M187 Wireless Azul - 910-005360,"3,8 de 5 estrelas",2,"R$43,53"
#84,Mouse Sem Fio Mobile Usb Roxo Microsoft - U7Z00048,"4,7 de 5 estrelas",197,"R$75,91"
#85,Mouse Logitech M105 USB Vermelho - 910-002959,"5,0 de 5 estrelas",1,"R$39,90"
#86,Mouse Gamer IRON MAN com Led 6 botões Verde KNUP KP-V22,,,
#87,Mouse Wireless Premier Dell WM527 Preto,"4,1 de 5 estrelas",24,"R$209,00"
#88,"Ms304 mouse fire, oex, mouses, preto.","5,0 de 5 estrelas",4,"R$44,90"
#89,Mouse Multilaser Optico Classic Preto 1200 Dpi Preto Usb - MO179,"3,9 de 5 estrelas",5,"R$7,50"
#90,Mouse Bright Suiça sem Fio – Prata/Preto,"5,0 de 5 estrelas",3,"R$14,57"
#91,Mouse Logitech M585 Bluetooth Preto - 910-005012,"4,7 de 5 estrelas",21,"R$179,90"
#92,"Basilisk Quartz, Razer, Mouses","5,0 de 5 estrelas",2,"R$549,00"
#93,Mini Mouse Multilaser Retrátil Usb Com Scroll - MO048,,,"R$18,90"
#94,Microsoft Mouse Com Fio Comfort Usb Preto/Cinza - 4FD00025,"4,1 de 5 estrelas",11,"R$99,36"
#95,"HP X3000 Mouse optico Sem fio, Preto (Black/Mettalic Grey)","4,8 de 5 estrelas",8,"R$63,90"
#96,MOUSE OPTICO SEM FIO M510 PRETO - LOGITECH,"5,0 de 5 estrelas",1,"R$123,00"
#97,"Mouse Alienware Advanced Gaming - AW558, Dell, Mouses","5,0 de 5 estrelas",9,"R$300,00"
#98,"MOUSE SEM FIO HP, Z3700 1200DPI VERMELHO","5,0 de 5 estrelas",3,"R$58,00"
#99,Mouse Sem Fio Recarregável Ergonômico Vertical 1600 Dpi 2.4g,"5,0 de 5 estrelas",1,"R$124,99"
#100,Warrior Gamer Mouse Laser 6 Botoes 3200 Dpi Preto Usb - MO191,"4,8 de 5 estrelas",5,"R$89,21"
