排名,品名,評價,評論數,價格
#1,Teclado Básico Slim Preto Usb Multilaser- TC204,"4,2 de 5 estrelas",108,"R$21,40"
#2,Teclado Com Fio 600 Usb Preto Microsoft - ANB00005,"4,9 de 5 estrelas",39,"R$69,90"
#3,Mini Teclado Original Touch Pad Para Celular Pc Android Tv Smart Tv Box Mxq Mx9 4k,"4,2 de 5 estrelas",3.254,"R$27,90"
#4,Teclado Logitech K480 Bluetooth Multi-device US 920-006348,"4,5 de 5 estrelas",66,"R$197,60"
#5,Teclado Logitech K230 Wireless Preto - 920-004425,"4,7 de 5 estrelas",79,"R$80,36"
#6,Teclado e Suporte Logitech Wireless K375S Grafite-920-008167,"4,5 de 5 estrelas",72,"R$188,96"
#7,Mini Teclado Multilaser Slim Comfort Usb - TC154,"3,8 de 5 estrelas",45,"R$37,10"
#8,Teclado Mecânico Para Games Com Fio Usb Spk8403 Philips,"4,9 de 5 estrelas",62,"R$151,15"
#9,Teclado + Mouse Logitech MK540 Wireless Preto - 920-008674,"4,7 de 5 estrelas",53,"R$199,99"
#10,"Mini Teclado Sem fio Iluminado Touch 3 Cores Led Tv box, Ps4, xbox,","4,7 de 5 estrelas",23,"R$27,50"
#11,Teclado + Mouse Logitech MK345 Wireless Preto - 920-007821,"4,6 de 5 estrelas",51,"R$165,90"
#12,Mini Teclado Iluminado Air Mouse Touch Wireless 3 Cores Led,"4,3 de 5 estrelas",73,"R$21,19"
#13,Teclado Logitech K400 Plus Wireless - 920-007125,"4,7 de 5 estrelas",219,"R$ 112,93"
#14,Mini Teclado Mouse Touchpad Wireless Bluetooth Iluminado Wifi Sem Fio I8.LED Tv Smart Box Usb Preto,"4,0 de 5 estrelas",41,"R$29,90"
#15,Teclado Mecânico Gamer Redragon Dark Avenger Switch Outemu Blue RGB ABNT2 - K568RGB-1,"5,0 de 5 estrelas",18,"R$399,33"
#16,Teclado Multimídia Dell KB216 - em Português,"4,5 de 5 estrelas",31,"R$89,00"
#17,"Teclado Usb, C3Tech,  Kb-11Bk, Teclados","4,0 de 5 estrelas",2,"R$24,25"
#18,Teclado Bluetooth Padrão Apple Imac Macbook Iphone,"3,7 de 5 estrelas",14,"R$84,80"
#19,"Teclado Multilaser Slim com Fio USB Teclas Silenciosas Preto - TC213, Multilaser, Teclados, Windows ou Mac OS, Preto","5,0 de 5 estrelas",1,"R$22,90"
#20,Mini Teclado Wireless Tv Box Pc Android Tv Smart,"4,1 de 5 estrelas",18,"R$37,39"
#21,Mini Teclado Bluetooth Super Slim C/ç Smart Not Tv Cel,"4,3 de 5 estrelas",10,"R$54,80"
#22,Teclado Arranjador PSR-E463 Preto YAMAHA,"5,0 de 5 estrelas",4,"R$1.798,00"
#23,Mouse Pad Gamer Extra Grande 700x350x3mm com Bordas Costuradas e Base Antiderrapante,"4,6 de 5 estrelas",77,"R$25,40"
#24,Teclado mêcanico Gamer Logitech G613 - 920-008387,"4,3 de 5 estrelas",26,"R$727,18"
#25,Teclado Logitech K270  Wireless Preto - 920-004427,"4,1 de 5 estrelas",19,"R$119,88"
#26,Teclado sem Fio 850 USB Preto Microsoft - PZ300005,"4,9 de 5 estrelas",18,"R$133,41"
#27,Teclado Multimídia USB Dell KB522,"5,0 de 5 estrelas",2,"R$129,00"
#28,Teclado Bluetooth Universal sem Fio Ipad Iphone Computador Android Mac Note,"5,0 de 5 estrelas",1,"R$59,90"
#29,Teclado Genius 31300725107 Luxemate 100 USB Preto,"5,0 de 5 estrelas",2,"R$59,00"
#30,Teclado Multilaser Slim Standard USB Preto - TC065,"3,7 de 5 estrelas",55,"R$36,19"
#31,"Teclado Usb, C3Tech, Kb2237-2, Teclados","4,7 de 5 estrelas",4,"R$25,90"
#32,"Teclado Bluetooth 3 em 1 para Android iOS e Windows, Multilaser, TC220, Teclados, Android, iOS e Windows, Preto","3,2 de 5 estrelas",4,"R$142,41"
#33,"Teclado Mecânico LED RGB ABNT2, Switch Outemu, Teclas Double Shot, Anti-Ghosting, Havit, KB493L, Marrom","5,0 de 5 estrelas",9,"R$245,50"
#34,Teclado Multimídia Usb Resistente a Água - Ltk-663,,,"R$22,44"
#35,Teclado Multilaser Slim Preto Laser Usb - TC193,,,"R$22,90"
#36,Teclado Numérico USB,,,"R$51,70"
#37,Teclado Bluetooth para Pc Tablet e Smartphone sem fio,"4,0 de 5 estrelas",15,"R$57,90"
#38,Teclado Ps2 Preto Padrão Abnt2 110 Teclas 7636 Leadership,,,"R$15,00"
#39,Teclado Logitech K120 USB  PRETO - 920-004423,"4,7 de 5 estrelas",57,"R$48,44"
#40,Teclado sem Fio com Touchpad Integrado USB Preto Microsoft - N9Z00005,"4,6 de 5 estrelas",13,"R$242,12"
#41,Teclado Philips Gamer Mecânico Luminoso Usb Spk8413,"4,4 de 5 estrelas",20,"R$184,70"
#42,Teclado Multimídia Usb Preto Multilaser- Tc206,"3,7 de 5 estrelas",7,"R$31,90"
#43,Teclado Mecânico Gamer Redragon MITRA RGB - Switch Outemu Blue - K551RGB-1 - ABNT2,"5,0 de 5 estrelas",11,"R$277,90"
#44,Mini Teclado Bluetooth Super Slim C/ç Smart Not Tv Cel,"3,9 de 5 estrelas",8,"R$56,98"
#45,Mini Teclado Sem Fio PC Note Smart TV Iluminado,"3,3 de 5 estrelas",3,"R$39,90"
#46,"Tc308 pr c vm, oex, teclados, preto com vermelho.",,,"R$ 39,90"
#47,"C3TECH CETech K-W40 Kit Teclado E Mouse Sem Fio, Preto, Amarelo","3,3 de 5 estrelas",12,"R$82,16"
#48,"Teclado, OEX, TC308, Teclados, Preto com Azul","2,0 de 5 estrelas",1,"R$34,47"
#49,Mini Teclado Wireless Tv Box Pc Android Tv Smart,"4,2 de 5 estrelas",21,"R$22,27"
#50,Teclado Mecânico Gamer Rainbow Evolut Gamer Switch Content Blue ANSI 12 Teclas Multimídia - EG-204RB,"5,0 de 5 estrelas",2,"R$160,70"
#51,"Teclado Basico Slim Laser USB Preto, Multilaser, TC193BU","4,3 de 5 estrelas",11,"R$36,58"
#52,Mini Teclado Wireless Keyboard com Touchpad Com Led Usb Android Console e Tv,"5,0 de 5 estrelas",2,"R$31,95"
#53,Teclado Mecânico Gamer Gamdias Hermes E2 Switch Huano Blue Rainbow ABNT2 Padrão Brasileiro TKL,"5,0 de 5 estrelas",1,"R$184,90"
#54,Teclado Multilaser Básico Chocolate Usb - TC142,"4,2 de 5 estrelas",11,"R$45,42"
#55,Teclado Logitech Multi Device Bluetooth K480 com apoio,,,"R$ 206,15"
#56,TECLADO MECANICO REDRAGON KALA RGB BROWN K557RGB,,,"R$293,00"
#57,"Teclado Usb 100, Hp, 2Un30Aa, Teclados","4,4 de 5 estrelas",2,"R$59,90"
#58,Teclado Positivo Unique S1991i,,,"R$64,00"
#59,"Teclado Usb Padrão, C3Tech, Kb-12Bk, Teclados","3,5 de 5 estrelas",7,"R$25,32"
#60,"Teclado Gaming USB KMG78, G-Fire, Teclados, Preto",,,"R$199,28"
#61,"Fortrek Spider Venom 2 GK-705 Teclado Gamer Multimídia, Preto/Vermelho","4,6 de 5 estrelas",68,"R$ 109,90"
#62,MOUSE BUNGEE FALLEN TUCANO PRETO,,,"R$ 114,71"
#63,"Teclado Mecânico LED HV-KB435L USB ABNT2 Switch Outemu Brown Anti-Ghosting, Havit para Windows 10/Win 8/Win 7/Vista/Mac/Linux, Preto","4,6 de 5 estrelas",11,"R$199,90"
#64,Teclado Mecânico Gamer Redragon Mitra Switch Brown com fio,,,"R$220,00"
#65,Magic Keyboard 2 - inglês (EUA) - MLA22BZ/A,"5,0 de 5 estrelas",2,"R$661,98"
#66,"Teclado Numérico Multilaser Com Cabo Retrátil Usb 20 Teclas Preto - Tc230, Multilaser, Teclados, Windows 98/ ME/ 2000/ XP/Vista ou superior, Preto",,,"R$28,41"
#67,Teclado Multimidia USB MKL-101 Preto Lite,,,"R$56,00"
#68,"Teclado Mecânico LED RGB, Havit, KB492L, Abnt2, Switch Outemu Brown, Teclas Double Shot, Anti-Ghosting","5,0 de 5 estrelas",1,"R$264,90"
#69,Teclado Multilaser Usb Multimídia Chocolate Usb - TC143,"4,7 de 5 estrelas",5,"R$49,89"
#70,Mini Teclado Air Mouse Touch Sem Fio Tv Box Wireless Com Luz Noturna,,,"R$29,20"
#71,Teclado Gamer Led Ant-ghost Lançamento Wb-538,,,"R$56,93"
#72,Teclado Mecânico Gamer Redragon Kumara Switch Outemu Red RGB K552 ABNT2,"5,0 de 5 estrelas",2,"R$265,30"
#73,Teclado Keyboard Bluetooth Wireless Sem Fio Notebook (Branco),"3,0 de 5 estrelas",10,"R$52,82"
#74,Teclado Mecânico Motospeed CK62 Bluetooth Gamer Branco Switch Azul RGB,,,"R$334,90"
#75,"Teclado Usb, C3Tech, Kb-M60Bk, Teclados","1,0 de 5 estrelas",1,"R$44,53"
#76,Teclado Arranjador Yamaha Psre263,"4,6 de 5 estrelas",162,"R$839,90"
#77,Teclado Infantil Piano Coração Art Brink 16 cm,"5,0 de 5 estrelas",1,"R$34,99"
#78,Teclado para Notebook Samsung NP300E4A-AD1br,,,"R$ 73,90"
#79,Teclado Philips Luminoso Mecânico Usb Spk-8404,"4,4 de 5 estrelas",38,"R$139,90"
#80,"Teclado Multimidia Concept Usb 2.0, Maxprint, Teclados",,,"R$22,11"
#81,"Teclado Multimidia USB MKL-101 Preto FORTREK, Fortrek, Teclados","5,0 de 5 estrelas",4,"R$28,99"
#82,Teclado Design By Apple Bluetooth Pc Mac Tablet Ios Android Com Ç,"3,1 de 5 estrelas",11,"R$84,95"
#83,Teclado Gamer Usb 2.0 Led 3 Cores Anti Ghost Haiz Hz110 (PRETO),"3,1 de 5 estrelas",12,"R$50,00"
#84,Teclado Multilaser Básico Slim Preto Com Conector Ps/2 Preto - TC225,"5,0 de 5 estrelas",1,"R$23,18"
#85,Teclado Pop OEX Com Teclas Redondas Silenciosas com Apoio de Punho Plug & Play TC401 Branco,"3,6 de 5 estrelas",5,"R$64,90"
#86,"Teclado Numérico Multilaser Com Fio Usb 20 Teclas Preto - Tc229, Multilaser, Teclados, Windows 98/ ME/ 2000/ XP/Vista ou superior, Preto","4,0 de 5 estrelas",3,"R$31,90"
#87,Teclado Gamer Logitech G213 Prodigy - - 920-008083,"4,5 de 5 estrelas",1.582,"R$310,00"
#88,"Teclado Gamer Mecanico One Sideprint, Ducky Channel, DKON1608-BUSPBAAB1","4,8 de 5 estrelas",6,"R$615,57"
#89,Teclado PS2 - Dim Preto - Bright,"3,0 de 5 estrelas",1,"R$ 24,90"
#90,Teclado Usb Tt Esports Knucker Plunger Thermaltake,"5,0 de 5 estrelas",2,"R$141,34"
#91,Ultra Mini Teclado Wireless Keyboard Touchpad Bluetooth,,,"R$69,99"
#92,"Teclado BlackWidow Essential, Razer, Teclados, Preto","5,0 de 5 estrelas",1,
#93,Teclado touch premium,"5,0 de 5 estrelas",1,"R$ 189,90"
#94,Teclado Logitech Bluetooth K380 Preto - 920-007564 Padrao US,"4,2 de 5 estrelas",12,"R$299,99"
#95,"TC500 PRETO, OEX, Teclados, PRETO","5,0 de 5 estrelas",4,"R$132,78"
#96,Teclado Mecânico Motospeed CK104 Gamer Preto Switch Azul RGB ABNT2,,,
#97,"Teclado Waldman KeyPro 54 - Display em LED, 54 Teclas, com Microfone e Estante para Partitura","5,0 de 5 estrelas",2,"R$ 358,00"
#98,"Teclado Magic Keyboard Apple para Mac, Cinza Espacial, Bluetooth - Mrmh2bz/a","5,0 de 5 estrelas",3,"R$1.018,98"
#99,MINI TECLADO WIRELESS TOUCH PAD PARA RASPBERRY ODROID BANANA ORANGE PC SMART TV,"4,5 de 5 estrelas",11,"R$28,39"
#100,Teclado - USB - Microsoft Natural Ergonomic Keyboard 4000 - Preto - B2M-00012 / 5QH-00001 (Layout Americano),"4,3 de 5 estrelas",4.353,"R$647,05"
