品名,價格,價格2,折扣%,評價,評論數
Logitech M100R Wired Optical Mouse,₹449,₹495,9% off,3.9,"(1,662)"
Logitech M90 Wired Optical  Gaming Mouse,₹349,₹395,11% off,4.3,"(1,042)"
Logitech Mk235 Mouse & Wireless Laptop Keyboard,"₹1,299","₹1,995",34% off,4.3,"(1,675)"
Logitech MK240 Wireless Keyboard and Mouse Combo,"₹1,399","₹1,500",6% off,4.4,"(23,712)"
Logitech MK220 Mouse & Wireless Laptop Keyboard,"₹1,249","₹1,790",30% off,4.3,"(13,378)"
Logitech K120 Wired USB Desktop Keyboard,₹549,₹695,21% off,4.4,"(3,004)"
Logitech MK240 Wireless Keyboard and Mouse Combo,"₹1,399","₹1,500",6% off,4.3,"(5,704)"
Logitech MK275 Mouse & Wireless Laptop Keyboard,"₹1,521","₹2,095",27% off,4.4,"(1,311)"
Logitech K120 DEVNAGRI (HINDI+ENGLISH) Wired USB Deskto...,₹725,₹795,8% off,4.3,(110)
Logitech MK345 Mouse & Wireless Laptop Keyboard,"₹2,089","₹2,995",30% off,4.3,(630)
Logitech B175 Wireless Optical Mouse,₹599,₹925,35% off,4.5,"(87,894)"
Logitech B100 Wired Optical Mouse,₹279,₹345,19% off,4.4,"(16,513)"
Logitech HD Webcam C270,"₹1,499","₹1,995",24% off,4.3,"(3,161)"
Logitech M221 Silent USB Mouse (Black) Wireless Optical...,"₹1,099","₹1,398",21% off,4.8,(9)
Logitech B170 Wireless Optical Mouse,₹599,₹795,24% off,4.5,"(4,635)"
Logitech USB Headset H340 Wired Headset,"₹2,285","₹2,595",11% off,4.2,(185)
Logitech Z120 MINI USB POWERED STEREO Speaker Mount,₹949,"₹1,195",20% off,,
Logitech K480 Multi Device Bluetooth Keyboard-Black Wir...,"₹2,374","₹2,995",20% off,4.4,(172)
Logitech k480 Bluetooth Multi-device Keyboard,"₹2,295","₹2,995",23% off,4.3,(61)
Logitech G402 Wired Optical Gaming Mouse,"₹2,599","₹2,990",13% off,4.7,"(2,460)"
Logitech MK200 Mouse & Wired USB Laptop Keyboard,"₹1,129","₹1,395",19% off,4.4,"(2,401)"
Logitech MK120 USB 2.0 Keyboard and Mouse Combo,₹950,"₹1,199",20% off,4.3,(780)
Logitech K120 Wired Keyboard Wired USB Desktop Keyboard,₹740,₹795,6% off,5,(3)
Logitech G102 Wired Optical  Gaming Mouse,"₹1,899","₹1,999",5% off,4.6,"(2,671)"
"Logitech MK850 PERFORMANCE Bluetooth, Smart Connector, ...","₹5,759","₹7,495",23% off,4.6,(9)
Logitech G413 Wired USB Gaming Keyboard,"₹5,995","₹7,495",20% off,4.9,(33)
Logitech K400r wireless touch keyboard,"₹3,520","₹3,600",2% off,4.4,(397)
Logitech 01 Mousepad,₹99,₹243,59% off,3.9,"(3,078)"
Logitech M-171 Wireless Optical Mouse,₹579,₹825,29% off,4.5,"(2,529)"
Logitech G502 USB Gaming Mouse (Black) Wired Optical  G...,"₹4,599","₹6,497",29% off,,
Logitech C310 HD Webcam,"₹1,979","₹2,295",13% off,4.4,"(1,681)"
Logitech M-171 Wireless Optical Mouse,₹599,₹825,27% off,4.5,"(2,529)"
Logitech 993-000439 USB Adapter,₹663,"₹2,295",71% off,3.8,(5)
Logitech Car Mobile Holder for Dashboard,"₹1,584","₹3,287",51% off,,
Logitech K120 USB Keyboard Black Wired USB Multi-device...,₹695,,,,
Logitech K230 Wireless Laptop Keyboard,"₹1,035","₹1,095",5% off,4.3,"(6,954)"
Logitech Logitech Ultrathin Bluetooth Keyboard for ipad...,"₹3,500","₹6,700",47% off,4.1,(17)
Logitech K380 Multi-device Bluetooth Keyboard Bluetooth...,"₹3,495","₹3,990",12% off,,
Logitech K120 Wired USB Multi-device Keyboard,₹795,"₹1,238",35% off,,
Logitech k375s Bluetooth Laptop Keyboard,"₹2,291",,,4.4,(19)
Logitech Stereo Headset H110 Wired Headset,₹694,₹850,18% off,4.3,(4)
Logitech Keyboard Case for Apple iPad Air 2,"₹5,429","₹19,998",72% off,,
Logitech Create 9.7 inch iPad Pro Smart Connector Table...,"₹9,999","₹10,000",,3.2,(5)
Logitech MK120 USB 2.0 Keyboard and Mouse Combo,"₹1,099","₹1,199",8% off,4.3,(780)
Logitech K 400 PLUS TV Wireless Laptop Keyboard,"₹3,095","₹3,995",22% off,4.3,(412)
Logitech 920-003070 Wireless Laptop Keyboard,"₹5,000","₹7,000",28% off,,
Logitech K480 Bluetooth Multi-device Keyboard,"₹2,875","₹2,999",4% off,4.3,(915)
Logitech PN 920-007119 Wireless Tablet Keyboard,"₹3,195","₹3,995",20% off,3.6,(12)
Logitech MK270r Wireless Combo Keyboard,"₹1,899","₹2,009",5% off,4.4,"(1,812)"
Logitech M171 Wireless Optical Mouse,₹800,"₹1,017",21% off,4.5,"(2,529)"
Logitech K120 HINDI + ENGLISH Wired USB Desktop Keyboar...,"₹1,430","₹2,050",30% off,3.8,(5)
Logitech MK100 PS/2 Keyboard and USB Mouse Combo,₹969,"₹1,100",11% off,4.1,(343)
Logitech cm Mousepad,₹99,₹299,66% off,3.9,(388)
Logitech M100R Wired Optical Mouse,₹449,₹495,9% off,3.9,"(1,662)"
Logitech M331 SILENT Wireless Optical Mouse,₹974,"₹1,395",30% off,4.6,(519)
Logitech Pebble M350 Wireless Optical Mouse,"₹1,899","₹1,995",4% off,4.7,(27)
Logitech M331 SILENT Wireless Optical Mouse,"₹1,049","₹1,645",36% off,4.6,(519)
Logitech H111 With Mic 3.5MM Jack Wired Headset,₹750,₹795,5% off,3.9,(155)
Logitech Front & Back Case for iPad Air 1st Gen,"₹3,245","₹3,311",1% off,,
Logitech M90 Wired Optical  Gaming Mouse,₹349,₹395,11% off,4.3,"(1,042)"
Logitech M220 Wireless Multi-device Keyboard,"₹1,490","₹1,550",3% off,,
Logitech K120 WIERD KEYBOARD HINDI+ENGLISH 4PC Wired US...,"₹2,410","₹4,100",41% off,,
Logitech K120 WIERD KEYBOARD HINDI+ENGLISH 5PC Wired US...,"₹2,950","₹5,125",42% off,,
Logitech M221 Silent USB Mouse (Black) Wireless Optical...,"₹1,099","₹1,398",21% off,4.8,(9)
Logitech K120 WIERD KEYBOARD HINDI+ENGLISH Wired USB Mu...,"₹1,860","₹3,075",39% off,,
Logitech MLA22HN/A Wireless Desktop Keyboard,"₹8,300",,,,
Logitech MK 215 Mouse Combo & Wireless Laptop Keyboard,"₹1,749","₹1,895",7% off,4.3,"(2,943)"
Logitech MK220 Wireless combo keyboard and mouse Wirele...,"₹1,850","₹1,995",7% off,,
Logitech LO-ky596 Wired USB Desktop Keyboard,"₹1,200",,,,
Logitech G402 Wired Optical Gaming Mouse,"₹2,599","₹2,990",13% off,4.7,"(2,460)"
Logitech Pebble M350 Wireless Optical Mouse,"₹1,899","₹1,995",4% off,4.7,(27)
Logitech 910-005388 R500 Presenter,"₹3,795","₹4,367",13% off,4.6,(21)
Logitech G102 Wired Optical  Gaming Mouse,"₹1,899","₹1,999",5% off,4.6,"(2,671)"
Logitech G502 USB Gaming Mouse (Black) Wired Optical  G...,"₹4,599","₹6,497",29% off,,
Logitech HD Webcam C615,"₹4,799","₹7,495",35% off,4.2,(42)
Logitech G430 Surround Sound Wired Headset,"₹6,050","₹7,095",14% off,4.4,(58)
Logitech MK520 Wireless Keyboard and Mouse Combo Combo ...,"₹8,375","₹9,276",9% off,,
Logitech LO-ky595 Wired USB Desktop Keyboard,"₹1,200",,,,
Logitech Create Back lit Keyboard case Smart Connector ...,"₹14,000",,,,
Logitech MK840 Mouse & Wired USB Multi-device Keyboard,"₹6,497",,,,
Logitech R400 Wireless Laser Presenter,"₹3,400","₹4,500",24% off,4.5,(557)
Logitech Gamepad F310,"₹1,880","₹2,171",13% off,4.5,"(2,962)"
Logitech H390 Bluetooth Headset,"₹3,543","₹3,914",9% off,4.7,(23)
Logitech K120 Wired USB Multi-device Keyboard,₹690,"₹1,255",45% off,3,(16)
Logitech PN 920-0071192 Wireless Laptop Keyboard,"₹3,175","₹3,995",20% off,4.1,(37)
Logitech K 120 WIRED KEYBOARD Wired USB Multi-device Ke...,₹950,₹999,4% off,2.3,(3)
Logitech K350 Wireless Laptop Keyboard,"₹6,450","₹6,748",4% off,,
Logitech 920-007558 Bluetooth Laptop Keyboard,"₹4,535","₹5,122",11% off,,
Logitech 920-002359 Wireless Laptop Keyboard,"₹9,064","₹10,457",13% off,,
Logitech ACEBTKEY Wired USB Desktop Keyboard,"₹7,229","₹9,750",25% off,,
Logitech 920-008350 Wired USB Desktop Keyboard,"₹9,064","₹10,206",11% off,,
Logitech M235 Wireless Optical Mouse,₹949,"₹1,250",24% off,4.5,"(9,258)"
Logitech Z506 75 W Home Theatre,"₹7,100","₹9,995",28% off,4.2,(170)
Logitech LOGITECH M170 Wireless Optical Mouse,₹620,₹899,31% off,4.4,(49)
Logitech M585 Multi-Device Multi-Tasking Wireless Optic...,"₹1,799","₹2,645",31% off,4.5,(10)
Logitech H110 Wired Headset,₹674,₹745,9% off,3.8,(150)
rivansh round Wireless Mike Multi-function Bluetooth Mi...,₹427,"₹1,699",74% off,3.5,(15)
Logitech K750 Wireless Gaming Keyboard,"₹7,043","₹7,595",7% off,,
HP C2500 Wired Combo keyboard and Mouse,₹698,₹977,28% off,4.3,"(15,282)"
Dell KM117 Wireless Laptop Keyboard,"₹1,281","₹1,399",8% off,4.4,"(11,162)"
Amkette Xcite NEO Wired USB Laptop Keyboard,₹399,₹549,27% off,4.2,"(9,702)"
Lenovo KB MICE_BO Wireless combo 100 Eng Wireless Lapto...,"₹1,198","₹1,999",40% off,4.3,"(4,084)"
Dell KB 216 Wired USB Desktop Keyboard,₹574,₹649,11% off,4.4,"(8,535)"
Amkette Xcite Neo Mouse & Wired USB Laptop Keyboard,₹549,₹729,24% off,4.2,"(4,219)"
Flipkart SmartBuy Wireless Keyboard & Mouse Combo,"₹1,199","₹1,299",7% off,4.3,"(23,077)"
Logitech Bluetooth mouse M337 Wireless Optical Mouse,"₹1,099","₹2,495",55% off,4.5,(237)
Logitech MX ANYWHERE 2S Wireless Hybrid Mouse,"₹5,498","₹6,995",21% off,4.7,(3)
Logitech M720 Wireless Optical Mouse,"₹4,995",,,,
Logitech 10l Mousepad,₹399,₹999,60% off,4.1,(19)
Logitech H600 Bluetooth Headset,"₹5,099","₹5,995",14% off,3.6,(25)
Saco Keyboard Case for Logitech Easy-Switch K810 / K811...,₹315,₹800,60% off,,
Amkette Xcite Pro Mouse & Wired USB Laptop Keyboard,₹639,₹749,14% off,4.2,"(2,081)"
HP 100 Wired USB Desktop Keyboard,₹549,₹799,31% off,4.4,"(1,541)"
Flipkart SmartBuy Multi Device USB Keyboard,₹549,₹899,38% off,4.3,"(2,633)"
Quantum QHM7710 Multimedia Combo Wired USB Multi-device...,₹449,₹480,6% off,3.9,(963)
Microsoft Surface Go Magnetic Tablet Keyboard,"₹11,799",,,4.6,(489)
Lenovo 510 Mouse & Wireless Laptop Keyboard,"₹1,699","₹2,999",43% off,4.2,(249)
HP K2500 E5E77AA Wireless Desktop Keyboard,₹899,"₹1,299",30% off,4.2,(341)
Microsoft Surface Go Magnetic Tablet Keyboard,"₹8,699",,,4.6,(489)
Techtest Adjustable Desktop Suspension Mic Boom Scissor...,₹648,"₹2,000",67% off,,
Logitech M100R Wired Optical Mouse,₹408,₹495,17% off,3.9,"(1,662)"
Logitech MX Master 2S Wireless Touch Mouse,"₹5,495","₹6,537",15% off,4.4,(141)
Logitech 5 Pcs Comfort Mouse Pad Long Lasting HEAVY Mou...,₹245,₹350,30% off,3.8,(185)
Logitech MK120 USB 2.0 Keyboard and Mouse Combo,"₹1,099","₹1,199",8% off,4.3,(780)
Logitech 001 Mousepad,₹99,₹399,75% off,3.5,(62)
Logitech H150 Stereo Headset Bluetooth Headset,"₹1,289","₹1,395",7% off,,
Headgear Audio Headphone Stand: Royal Shark for Sennhei...,"₹1,799","₹2,999",40% off,,
Rapoo E1050 Wireless keyboard (2.4 GHz),₹679,₹999,32% off,4.2,"(2,008)"
Microsoft Surface Pro Type Cover Magnetic Laptop Keyboa...,"₹11,099","₹13,399",17% off,4.6,(342)
Logitech M171 Wireless Optical Mouse,₹800,"₹1,017",21% off,4.5,"(2,529)"
Quantum QHM7307 MINI MULTIMEDIA KEYBOARD Wired USB Lapt...,₹399,₹450,11% off,3.9,(605)
Rapoo nk2500 Wired USB Desktop Keyboard,₹549,,,4.2,(79)
Lenovo KM4802 USB 2.0 Keyboard and Mouse Combo,₹960,₹999,3% off,4.2,"(2,848)"
Logitech M90 Wired Optical  Gaming Mouse,₹349,₹395,11% off,4.3,"(1,042)"
Microsoft Surface Go Magnetic Tablet Keyboard,"₹11,799",,,4.6,(489)
Rhobos Portable Mini Bluetooth Wireless Foldable Keyboa...,"₹2,139","₹2,999",28% off,5,(2)
Rapoo X1800 Wireless Keyboard and Mouse Combo,"₹1,750","₹1,799",2% off,4.2,(985)
Logitech WHITE MINI Wireless Optical Mouse,"₹1,025","₹1,095",6% off,3.4,(5)
Logitech Wireless Gamepad F710,"₹3,468","₹4,495",22% off,4.5,"(1,016)"
Logitech G402 Wired Optical Gaming Mouse,"₹2,599","₹2,990",13% off,4.7,"(2,460)"
Logitech M100R USB (Black) Wired Optical Mouse,₹490,₹495,1% off,4.4,(134)
Logitech HD WEBCAM C525  Webcam,"₹3,535","₹4,295",17% off,4.3,(170)
Logitech H111 Wired Headset without Mic,₹740,₹795,6% off,3.8,(115)
Logitech G102 Wired Optical  Gaming Mouse,"₹1,899","₹1,999",5% off,4.6,"(2,671)"
Logitech 'g' Series,"₹1,439","₹2,009",28% off,,
Zebronics Companion 103 Wireless Desktop Keyboard,"₹1,477","₹1,499",1% off,4,(33)
baluda BD-key board-03 Wireless Laptop Keyboard,"₹1,249","₹1,599",21% off,3.5,(19)
baluda Ultra Thin fashion 2.4G Wireless Wireless Laptop...,"₹1,249","₹1,389",10% off,,
HP KB0316 PS2 Desktop Keyboard,₹900,"₹1,000",10% off,,
Logitech G502 USB Gaming Mouse (Black) Wired Optical  G...,"₹4,599","₹6,497",29% off,,
Logitech MX Anywhere 2S Wireless Optical Mouse,"₹5,450","₹5,999",9% off,4.4,(141)
Logitech M221 Silent USB Mouse (Black) Wireless Optical...,"₹1,099","₹1,398",21% off,4.8,(9)
Logitech G300s Optical Gaming Mouse,"₹2,199","₹2,290",3% off,4.6,"(4,571)"
Logitech m100r-Black Wired Optical Mouse,₹463,₹495,6% off,4.3,(167)
Logitech h150-White Wired Headset,"₹1,294","₹1,445",10% off,3.5,(13)
Logitech,"₹1,439","₹2,009",28% off,,
Logitech M235 Wireless Optical Mouse,"₹1,199","₹1,296",7% off,4.5,"(9,258)"
Logitech MX 2S Wireless Optical Mouse,"₹7,825","₹7,995",2% off,,
Logitech M185 Wireless Optical Mouse,₹749,"₹1,055",29% off,4.3,"(1,049)"
Logitech C922 Pro Stream Webcam  Webcam,"₹10,450","₹10,999",4% off,4.3,(10)
Logitech 340 Headset Wired Headset,"₹2,280","₹2,495",8% off,,
Logitech G15,"₹1,439","₹2,009",28% off,,
Logitech VMP - L02 Mousepad,₹125,₹399,68% off,3.5,(35)
Logitech MK120 USB 2.0 Keyboard and Mouse Combo,"₹1,099","₹1,199",8% off,4.3,(780)
Logitech m100r Wired Optical Mouse,₹408,₹495,17% off,3.9,"(1,662)"
Logitech M90 Wired Optical  Gaming Mouse,₹349,₹395,11% off,4.3,"(1,042)"
Logitech HD Webcam C525,"₹3,099","₹4,295",27% off,4.3,(170)
Logitech B530 Wired Headset,"₹4,250","₹5,699",25% off,,
Logitech G19,"₹1,439","₹2,009",28% off,,
Logitech M171 Wireless Optical Mouse,₹800,"₹1,017",21% off,4.5,"(2,529)"
Logitech M105 Wired Optical Mouse,₹552,₹595,7% off,4.4,"(1,083)"
Logitech M 90 MOUSE Wired Optical  Gaming Mouse,₹328,₹395,16% off,4.4,(18)
Logitech MOUSE PAD 1 PCS VERY FAST PRODUCT Mousepad,₹120,₹199,39% off,2.9,(15)
Logitech M100R Wired Optical Mouse,₹449,₹495,9% off,3.9,"(1,662)"
Logitech G402 Wired Optical Gaming Mouse,"₹2,599","₹2,990",13% off,4.7,"(2,460)"
Logitech h151 Wired Headset,"₹1,290","₹1,495",13% off,3.9,(87)
Logitech G5,"₹1,439","₹2,009",28% off,,
Logitech 5 Pcs Comfort Mouse Pad Long Lasting Mousepad,₹225,₹350,35% off,4.1,(641)
Logitech Logi02 Mousepad,₹116,₹312,62% off,3.3,(38)
Logitech M221 Silent USB Mouse (Black) Wireless Optical...,"₹1,099","₹1,398",21% off,4.8,(9)
Logitech M590 Wireless Optical Mouse,"₹1,995","₹2,995",33% off,4.6,(68)
Logitech LOGIBLACK001 Mousepad,₹124,₹294,57% off,3.7,(595)
Logitech PN 981-000459 Wired Headset,₹675,₹745,9% off,3.7,(564)
Logitech G102 Wired Optical  Gaming Mouse,"₹1,899","₹1,999",5% off,4.6,"(2,671)"
Logitech G11,"₹1,439","₹2,009",28% off,,
Logitech Powershell Controller + Battery  Gamepad,"₹4,950","₹8,995",44% off,3.6,(46)
Logitech 2016 Mousepad,₹90,₹200,55% off,4,(597)
Logitech Z623 Stereo Speaker,"₹10,299","₹16,495",37% off,4.5,(188)
Logitech R800 Laser Presenter,"₹5,495","₹7,495",26% off,4.4,(89)
Logitech G502 USB Gaming Mouse (Black) Wired Optical  G...,"₹4,599","₹6,497",29% off,,
Logitech H150 Wired Headset,"₹1,290","₹1,495",13% off,3.9,(328)
Adada Pouch for Logitech mouse,"₹1,793","₹3,586",50% off,,
Logitech 1 Pcs Comfort Mouse Pad Long Lasting Mousepad,₹121,₹150,19% off,3.9,"(2,381)"
Logitech LOGIPURPLE001 Mousepad,₹99,₹300,67% off,2.8,(17)
Logitech Dotionmo Mousepad,₹125,₹150,16% off,,
Logitech LG005 Mousepad,₹105,₹299,64% off,3.8,(6)
Logitech H570e Wired Headset,"₹4,900","₹4,995",1% off,,
Hermitshell  Keyboard Case for Logitech,"₹3,205","₹4,167",23% off,,
"Logitech HD Webcam C525, Portable HD 720p Video Calling...","₹3,550","₹4,295",17% off,4.1,(14)
Logitech Pebble M350 Wireless Optical Mouse,"₹1,899","₹1,995",4% off,4.7,(27)
